question,document
What does floor price mean in the context of NFTs or digital assets?,00647bfd
How can floor price be used as a benchmark for asset value?,00647bfd
Is the floor price the same across different marketplaces for the same collection?,00647bfd
What is a fork in the context of blockchain technology?,75c21a36
Can you explain the difference between a hard fork and a soft fork?,75c21a36
How does a fork impact the existing blockchain and its users?,75c21a36
What is the role of a full node in a blockchain network?,44af59e0
How does a full node contribute to the security of a decentralized network?,44af59e0
What does it mean for a full node to fully enforce the rules of the protocol?,44af59e0
What is the purpose of the funding rate in perpetual contract markets?,e53194b9
How does a positive funding rate affect traders in a market?,e53194b9
In what situation do long traders pay short traders regarding the funding rate?,e53194b9
What exactly is a futures contract in the context of trading?,ba8ed1a2
How do traders use futures contracts to hedge against price volatility?,ba8ed1a2
In what ways can futures trading be advantageous for speculation in cryptocurrencies?,ba8ed1a2
What are the benefits of owning in-game assets as NFTs on Gala Games?,87abd7e4
How does the play-to-earn mechanism work within the Gala Games ecosystem?,87abd7e4
What role does the GALA token play in the Gala Games platform?,87abd7e4
What does GameFi allow players to earn through gameplay?,14995089
How does GameFi integrate elements of cryptocurrency and NFTs?,14995089
What kind of ecosystem does GameFi create for in-game activities?,14995089
What is the purpose of a gas fee in a blockchain network like Ethereum?,41ff713a
How do users pay gas fees when performing operations on the blockchain?,41ff713a
Who receives the gas fees collected from users on the network?,41ff713a
What is the gas limit in Ethereum transactions?,fd5be88b
How does the gas limit help manage network resources?,fd5be88b
Why is it important for transactions to have a gas limit?,fd5be88b
What is a gas optimizer and its purpose in blockchain transactions?,7c099f8f
How does a gas optimizer help in reducing gas fees specifically?,7c099f8f
In what ways can a gas optimizer improve the cost-effectiveness of executing smart contracts?,7c099f8f
What is the main purpose of a gas oracle in Ethereum transactions?,883bc6aa
How does a gas oracle help users avoid overpaying for gas fees?,883bc6aa
What factors do gas oracles consider when predicting gas prices?,883bc6aa
What does the gas price refer to in cryptocurrency transactions?,918d0868
How does gas price affect transaction processing on a blockchain?,918d0868
What factors influence the speed and priority of processing transactions in a blockchain network?,918d0868
What are gas wars in the context of blockchain transactions?,991eee31
How do gas wars affect the cost of transaction fees?,991eee31
What happens to the blockchain network during gas wars?,991eee31
What are gasless transactions in the context of blockchain?,3a3aec55
How are gas fees handled in gasless transactions?,3a3aec55
Can you explain how meta-transactions contribute to gasless transactions?,3a3aec55
What is a Gnosis Safe and how does it operate?,2cb89d7a
Why is Gnosis Safe popular in DAOs for managing funds?,2cb89d7a
How does the multi-signature feature of Gnosis Safe enhance security?,2cb89d7a
What is a governance proposal in the context of blockchain?,6806e3eb
Who can submit a governance proposal and how does it get approved?,6806e3eb
What process does a governance proposal go through after it is submitted?,6806e3eb
What are governance tokens and what role do they play in decentralized finance?,51b93416
How do governance tokens empower users in decentralized protocols?,51b93416
Can you give examples of governance tokens used in decentralized autonomous organizations?,51b93416
What is Guarda Wallet and how does it store cryptocurrencies?,84b5faf4
"Can I exchange cryptocurrencies using Guarda Wallet, and what types does it support?",84b5faf4
"What platforms can I use Guarda Wallet on, and what does non-custodial mean?",84b5faf4
What is the relationship between Gwei and Ether?,fec38278
How is Gwei used in the Ethereum network?,fec38278
How much is one Gwei worth in Ether?,fec38278
What does Halving mean in the context of cryptocurrency?,2a273ff9
How often does the Halving event occur in cryptocurrency networks?,2a273ff9
Why is Halving implemented in Bitcoin and what is its purpose?,2a273ff9
What happens to the existing cryptocurrency when a hard fork occurs?,f717398f
How does a hard fork create two separate blockchains?,f717398f
What can cause disagreements in the community that lead to a hard fork?,f717398f
What is the primary function of a hardware wallet in the context of cryptocurrency?,cd8c3321
How does a hardware wallet enhance security for cryptocurrency transactions?,cd8c3321
Why should I use a hardware wallet instead of storing my keys online?,cd8c3321
What does Harvest Finance do for its users in terms of yield farming?,14e5c38e
How does Harvest Finance maximize returns on users' investments?,14e5c38e
What is the role of the FARM token in the Harvest Finance platform?,14e5c38e
What does hashrate indicate in a Proof of Work blockchain?,4ecb36b5
How does a higher hashrate contribute to network security?,4ecb36b5
What is the relationship between hashrate and the speed of solving cryptographic puzzles?,4ecb36b5
What is the primary purpose of the Helium network in relation to IoT devices?,8900be75
How can individuals earn HNT tokens through the Helium network?,8900be75
What technology underpins the Helium network for providing connectivity?,8900be75
What does the term HODL mean in the context of cryptocurrencies?,993edd79
Why do investors choose to HODL their cryptocurrency investments?,993edd79
How did HODL originate as a term in the cryptocurrency community?,993edd79
What is a hot wallet in the context of cryptocurrencies?,a4925328
How does a hot wallet facilitate transactions?,a4925328
Why is a hot wallet considered more vulnerable than cold storage?,a4925328
What is the main purpose of Huobi Token (HT) within the Huobi cryptocurrency exchange?,5d0c3109
How does holding Huobi Token (HT) benefit users in terms of trading fees?,5d0c3109
What type of blockchain does Huobi Token (HT) operate on?,5d0c3109
What is Hyperledger Fabric and who is it designed for?,7c03bf13
How does Hyperledger Fabric differ from public blockchains regarding access control?,7c03bf13
What are smart contracts in Hyperledger Fabric called and what industries can benefit from it?,7c03bf13
What type of game is Illuvium and on which blockchain is it built?,7d1f2081
"Can players earn rewards in Illuvium, and if so, what is the currency used for those rewards?",7d1f2081
What activities can players engage in to interact with Illuvials in Illuvium?,7d1f2081
What is meant by 'impermanent loss' in a liquidity pool?,4df48dd2
How does impermanent loss affect liquidity providers in decentralized finance?,4df48dd2
In what circumstances can impermanent loss become significant for asset values?,4df48dd2
What types of cryptocurrencies can be managed with Infinity Wallet?,90ff9511
How does Infinity Wallet ensure user privacy and data security?,90ff9511
Is Infinity Wallet compatible with both desktop and mobile devices?,90ff9511
What is the primary purpose of an Initial Coin Offering (ICO) in the cryptocurrency space?,944e47e5
How do participants benefit from investing in an ICO?,944e47e5
What do new cryptocurrency projects typically offer in exchange for capital during an ICO?,944e47e5
What is the purpose of InstaDApp in the DeFi space?,3a4e7d53
How does InstaDApp simplify the management of DeFi strategies?,3a4e7d53
Which DeFi platforms are integrated into InstaDApp for user convenience?,3a4e7d53
What is the primary function of an interoperability bridge in blockchain technology?,62d4ee44
How does an interoperability bridge enhance decentralized applications across various blockchain networks?,62d4ee44
What benefits does cross-chain interaction provide when using an interoperability bridge?,62d4ee44
What is the main purpose of the InterPlanetary File System (IPFS)?,3334a5c9
How does IPFS ensure data storage and sharing among users?,3334a5c9
What advantages does IPFS offer over traditional centralized storage systems?,3334a5c9
What types of cryptocurrencies can KeepKey store securely?,3010e4bd
How does KeepKey protect private keys from internet exposure?,3010e4bd
"Can I trade cryptocurrencies directly through KeepKey, and how does it ensure security during trades?",3010e4bd
What is the role of Layer 0 in supporting multiple blockchains?,c4fe8318
How does Layer 0 contribute to scalability and security in blockchain technology?,c4fe8318
What components are included in the Layer 0 infrastructure?,c4fe8318
What is the primary function of a Layer 1 blockchain in the context of network operations?,97da07fe
Can you give me examples of popular Layer 1 blockchains and their use cases?,97da07fe
How do scaling solutions and smart contracts relate to Layer 1 blockchains?,97da07fe
What are some examples of Layer 2 solutions in blockchain technology?,9da13c7c
How does Layer 2 improve the effectiveness of a Layer 1 blockchain?,9da13c7c
In what way do Layer 2 protocols reduce congestion on the main blockchain?,9da13c7c
What role do Layer 3 protocols play in enhancing blockchain scalability?,d602161f
How do Layer 3 protocols improve decentralized applications?,d602161f
In what ways do Layer 3 protocols address high transaction costs?,d602161f
What does layered security aim to protect against in systems and data?,9a4b625f
How does layered security enhance overall protection compared to single security measures?,9a4b625f
What are some examples of security techniques that might be combined in layered security?,9a4b625f
What are the primary features that make Ledger Nano hardware wallets secure for storing cryptocurrencies?,37ad5593
How does Ledger Nano protect private keys from online threats?,37ad5593
In what way does Ledger Nano facilitate the management of digital assets for users?,37ad5593
What does the Lightning Network do to enhance Bitcoin transactions?,967fd79b
How does the Lightning Network help reduce transaction fees?,967fd79b
In what way does the Lightning Network maintain Bitcoin's security while allowing off-chain transactions?,967fd79b
What is the main purpose of Lightning Payment in the Bitcoin ecosystem?,0ac53aaa
How does the Lightning Network facilitate quick transactions compared to the main blockchain?,0ac53aaa
What advantages do off-chain payment channels provide in terms of transaction costs?,0ac53aaa
What is a limit order in trading terms?,3f08f44d
How does a limit order help traders avoid slippage?,3f08f44d
Is there a guarantee that a limit order will be executed?,3f08f44d
What is the primary feature of liquid democracy in terms of voting?,4ddf4b1c
How does liquid democracy enhance decision-making in blockchain governance?,4ddf4b1c
Can voters choose to delegate their voting power in a liquid democracy system?,4ddf4b1c
What is the main purpose of liquidity mining in decentralized finance?,9f466f03
How do participants benefit from liquidity mining in terms of rewards?,9f466f03
What do participants need to contribute to engage in liquidity mining activities?,9f466f03
What is a liquidity pool and what purpose does it serve in decentralized exchanges?,b266dc45
How do users benefit from providing assets to a liquidity pool?,b266dc45
What do users earn by contributing to a liquidity pool in terms of transaction fees or rewards?,b266dc45
Who created Litecoin and in which year?,d4a28f52
What is the difference in block generation times between Litecoin and Bitcoin?,d4a28f52
"What hashing algorithm does Litecoin use, and how does it affect transactions?",d4a28f52
What is the main function of a Mainnet in a cryptocurrency project?,447ec275
How does a Mainnet differ from testnets and development versions?,447ec275
What does it mean when a blockchain project has a fully operational Mainnet?,447ec275
What role do MKR holders play in the governance of the MakerDAO protocol?,b581ffd4
How does the value of MKR differ from the DAI stablecoin?,b581ffd4
What can MKR holders vote on regarding the Maker ecosystem?,b581ffd4
What is the role of MKR token holders in Maker Governance?,44d59ad3
How does Maker Governance ensure the stability of the DAI stablecoin?,44d59ad3
What types of decisions can be voted on within the Maker Governance process?,44d59ad3
What is MakerDAO and how does it operate within the Ethereum blockchain?,c6969fb4
How does MakerDAO enable users to generate DAI using collateral?,c6969fb4
Why is MakerDAO considered important in the context of decentralized finance (DeFi)?,c6969fb4
What is a man-in-the-middle attack in the context of cryptocurrency transactions?,2089d7b5
How can a malicious actor exploit a man-in-the-middle attack during communication with an exchange?,2089d7b5
What types of sensitive information are at risk during a man-in-the-middle attack?,2089d7b5
What is the basic concept of margin trading in cryptocurrencies?,580a18b1
How does margin trading affect potential profits and losses for traders?,580a18b1
What do traders typically use as collateral when engaging in margin trading with exchanges?,580a18b1
What role does a market maker play in providing liquidity to financial markets?,0446970f
How do market makers profit from their activities in trading assets?,0446970f
In what ways do market makers contribute to the stability of asset prices?,0446970f
What is the main purpose of creating a meme coin?,c7775f58
How do meme coins often gain popularity despite their lack of utility?,c7775f58
What role does community engagement play in the value of meme coins?,c7775f58
What is the main purpose of a Merkle proof in blockchain technology?,755b78dc
How does a Merkle proof contribute to data verification without exposing the full dataset?,755b78dc
In which blockchain systems are Merkle proofs commonly utilized for enhancing security and scalability?,755b78dc
What is the purpose of a Merkle tree in blockchain technology?,4c191d5d
How does a Merkle tree organize transactions?,4c191d5d
What do the leaf nodes and parent nodes represent in a Merkle tree?,4c191d5d
What is MetaMask and how does it function as a wallet?,086b6afd
Can I use MetaMask to manage ERC-20 tokens?,086b6afd
How does MetaMask ensure the security of my private keys?,086b6afd
What is the Metaverse and how is it created?,5c32a97c
What types of activities can users engage in within the Metaverse?,5c32a97c
How does blockchain technology play a role in the Metaverse?,5c32a97c
What is the primary purpose of a MEV bot in blockchain networks?,b6062870
How does a MEV bot maximize profit from transaction fees?,b6062870
What opportunities do MEV bots exploit in trading?,b6062870
What is the main function of an MEV Relay in the context of cryptocurrency transactions?,0e745580
How does an MEV Relay contribute to the optimization of transaction ordering for miners or validators?,0e745580
In what ways does an MEV Relay promote fairer extraction of Miner Extractable Value opportunities?,0e745580
What is the definition of Miner Extractable Value (MEV)?,56cebfea
How do miners or validators use MEV to their advantage?,56cebfea
What are some examples of opportunities associated with MEV?,56cebfea
What does minting mean in the context of NFTs?,692c8699
Can you explain how minting creates a unique token on the blockchain?,692c8699
What role does minting play in the ownership of digital content?,692c8699
What is the function of Mirror Protocol in decentralized finance?,c73e3eb2
How does Mirror Protocol allow users to trade without holding real assets?,c73e3eb2
On which blockchain does Mirror Protocol operate and what types of assets does it create?,c73e3eb2
What are the key features that make Monero prioritize privacy and anonymity?,48149380
What techniques does Monero use to ensure transaction details are obscured?,48149380
Why is Monero preferred by individuals seeking confidential financial transactions?,48149380
What does it mean when a project is described as multi-chain?,961deaed
How does multi-chain improve performance for blockchain applications?,961deaed
Can you explain the benefits of using multiple blockchains within a single ecosystem?,961deaed
What is the main function of multisig in cryptocurrency transactions?,90c964f1
How does multisig improve security for managing digital assets?,90c964f1
Why is it important to have multiple private keys in a multisig setup?,90c964f1
What type of game is My Neighbor Alice and what can players do in it?,24697a1f
How are in-game assets represented in My Neighbor Alice?,24697a1f
What role does the ALICE token play in the game's economy?,24697a1f
What features does MyEtherWallet (MEW) offer for managing Ethereum and tokens?,3f15a8cf
How does MyEtherWallet ensure user control over their private keys?,3f15a8cf
"Is MyEtherWallet a free service, and what type of interface does it provide for Ethereum interactions?",3f15a8cf
What is the primary purpose of the NetVRk platform in the context of virtual reality?,af198e54
How does NetVRk utilize NFTs within its metaverse environment?,af198e54
What role does the NTVRK token play in transactions and governance on the NetVRk platform?,af198e54
What happens to transaction fees during network congestion?,9ae8ad9a
How does network congestion affect transaction efficiency?,9ae8ad9a
What causes a blockchain network to experience congestion?,9ae8ad9a
What does NFT fractionalization mean in the context of digital assets?,59cd3865
How does NFT fractionalization make it easier for investors to participate in high-value NFTs?,59cd3865
Where can fractionalized NFTs be traded after their ownership is divided?,59cd3865
What is an NFT marketplace and what does it allow users to do?,39a76367
What types of digital assets can be found in an NFT marketplace?,39a76367
Are there specific features commonly found in NFT marketplaces for transactions?,39a76367
What does it mean to have control of private keys in a non-custodial wallet?,1aaf2990
How does a non-custodial wallet differ from a custodial wallet?,1aaf2990
What are the benefits of using a non-custodial wallet for my cryptocurrency?,1aaf2990
What makes a Non-fungible Token different from other tokens?,2b96816d
How is ownership of an NFT verified?,2b96816d
Can NFTs be divided into smaller parts for trading?,2b96816d
What is the main purpose of Ocean Protocol in relation to data providers?,3c5382ae
How does Ocean Protocol facilitate the trading of data assets?,3c5382ae
What role does the OCEAN token play within the Ocean Protocol ecosystem?,3c5382ae
What is the process involved in off-chain governance for blockchain networks?,b310128f
How does off-chain governance impact a blockchain's development and policies?,b310128f
In what ways can decisions be made outside of the blockchain network for off-chain governance?,b310128f
What is the process for making decisions in on-chain governance?,b5303e70
How does on-chain governance allow stakeholders to influence a blockchain's development?,b5303e70
What role do voting mechanisms play in on-chain governance?,b5303e70
What types of non-fungible tokens can I find on OpenSea?,2936a17c
How does OpenSea handle transactions for digital art and collectibles?,2936a17c
Can creators earn royalties when their NFTs are sold on OpenSea?,2936a17c
What is the main function of optimistic rollups in relation to blockchains?,c01ff69e
How do optimistic rollups handle the verification of transactions?,c01ff69e
In what ways do optimistic rollups improve scalability and reduce costs for decentralized applications?,c01ff69e
What role do Oracles play in connecting smart contracts with real-world data?,389c0801
How do Oracles impact decentralized applications and their functionality?,389c0801
Why are Oracles important for decentralized finance (DeFi) systems?,389c0801
What does order book depth indicate about market liquidity?,03c2374b
How does a deep order book affect price slippage during trading?,03c2374b
Can you explain the role of buy and sell orders in understanding order book depth?,03c2374b
What blockchain is PancakeSwap built on?,be48671d
How does PancakeSwap compare to Uniswap in terms of transaction fees?,be48671d
What type of tokens does PancakeSwap support for trading and yield farming?,be48671d
What is a paper wallet and how does it store cryptocurrency information?,dddb99c7
How does a paper wallet offer security compared to other storage methods?,dddb99c7
What precautions should I take to protect my paper wallet from damage or loss?,dddb99c7
What is the purpose of a participation reward in decentralized governance?,9ffdfa19
How do token holders benefit from participating in governance activities?,9ffdfa19
In what form are rewards typically given to users who engage in voting?,9ffdfa19
What are perpetual contracts and how do they compare to traditional futures contracts?,ee11e9a3
How long can a trader hold a position in a perpetual contract before it expires?,ee11e9a3
What is the funding rate mechanism associated with perpetual contracts and why is it important?,ee11e9a3
What is the main blockchain that Phantom Wallet is designed for?,f6650b15
What features does Phantom Wallet offer for managing Solana-based assets?,f6650b15
Is Phantom Wallet user-friendly for managing digital assets?,f6650b15
What kind of sensitive information do phishing attacks try to obtain from users?,d2dbbfe0
How do phishing attacks typically present themselves in the cryptocurrency space?,d2dbbfe0
What are some common methods used in phishing attacks to deceive users?,d2dbbfe0
What is the purpose of a Plasma chain in the context of Ethereum?,855eda4e
How does a Plasma chain help improve transaction throughput?,855eda4e
What is the relationship between Plasma chains and the main blockchain?,855eda4e
What are the primary benefits of engaging in Play-to-Earn games?,1e9f8e22
How does the gameplay in Play-to-Earn differ from conventional video games?,1e9f8e22
What types of rewards can players expect to earn in a Play-to-Earn gaming model?,1e9f8e22
What is Polkadot and how does it function as a multi-chain blockchain platform?,791e80c7
Who created Polkadot and what were the main issues it aims to address in blockchain technology?,791e80c7
How does Polkadot enable different blockchains to share information and support decentralized applications?,791e80c7
What is Polygon and how does it relate to Ethereum?,49649cce
In what ways does Polygon improve transaction efficiency compared to Ethereum?,49649cce
"Why is Polygon favored for decentralized applications, particularly in gaming and DeFi?",49649cce
What is the main purpose of a privacy coin in the cryptocurrency market?,0dda9371
How do privacy coins ensure transaction details remain hidden from external parties?,0dda9371
What cryptographic techniques are commonly used by privacy coins to enhance anonymity?,0dda9371
What is the primary function of trusted nodes in the Proof of Authority consensus mechanism?,c537dc2d
How does Proof of Authority differ from Proof of Work and Proof of Stake?,c537dc2d
What factors are considered in Proof of Authority for validating transactions?,c537dc2d
What does it mean to 'burn' tokens in the context of Proof of Burn?,1e9cb92e
How does Proof of Burn provide rewards to participants?,1e9cb92e
What are the advantages of using Proof of Burn over Proof of Work?,1e9cb92e
What is the primary resource used in the Proof of Capacity mining process?,5887fea9
How does the amount of storage space affect the likelihood of mining new blocks in Proof of Capacity?,5887fea9
In what way does Proof of Capacity differ from Proof of Work regarding energy efficiency?,5887fea9
What is the role of random waiting periods in the PoET consensus algorithm?,ef7489f1
How does a participant win the right to create a block in the PoET system?,ef7489f1
Can you explain how PoET determines who adds a block to the blockchain?,ef7489f1
What is the main purpose of Proof of History in blockchain technology?,3398bb07
How does Proof of History improve transaction ordering on a blockchain?,3398bb07
What role do timestamps and cryptographic proofs play in Proof of History?,3398bb07
How does the amount of cryptocurrency held influence the selection of validators in Proof of Stake?,3c2a599d
What are the benefits of Proof of Stake compared to Proof of Work in terms of energy consumption?,3c2a599d
In what way does Proof of Stake encourage validators to behave in the best interests of the network?,3c2a599d
What is the primary purpose of Proof of Storage in blockchain technology?,dc96c569
How does Proof of Storage ensure data remains secure and accessible?,dc96c569
In what type of networks is Proof of Storage commonly used?,dc96c569
What is the main purpose of the Proof of Work algorithm in blockchain?,753aee0d
How do miners use Proof of Work to create new blocks?,753aee0d
Why is significant computational power required in Proof of Work?,753aee0d
What does proposal threshold mean in decentralized governance?,08b35fc0
How does proposal threshold prevent spam proposals?,08b35fc0
Why is voting power important for submitting proposals?,08b35fc0
What is a protocol upgrade in the context of blockchain technology?,281ea7b2
How do changes in a blockchain's protocol enhance its functionality?,281ea7b2
What are the differences between a hard fork and a soft fork regarding protocol upgrades?,281ea7b2
How does quadratic voting allow participants to express their preferences in a voting system?,c6319dd9
What is the significance of the quadratic cost structure in quadratic voting?,c6319dd9
In what way does quadratic voting contribute to balanced decision-making in decentralized governance?,c6319dd9
What is the main purpose of Quant in the blockchain space?,9427ccc8
