question,document
What happens during a 34% attack in a blockchain network?,4c1e419c
How can an entity disrupt a blockchain with a 34% attack?,4c1e419c
Why is controlling more than 34% of a network power significant in Proof-of-Stake systems?,4c1e419c
What happens when an entity achieves a 51% attack on a blockchain network?,078e9f04
How can controlling over 50% of mining power affect a blockchain's integrity?,078e9f04
What are the potential consequences of a 51% attack for coin transactions?,078e9f04
What is the primary function of the Aave protocol?,9afbd80e
Can you explain what a flash loan is in the context of Aave?,9afbd80e
How does Aave enable users to earn interest on their deposited cryptocurrencies?,9afbd80e
What are Aavegotchis and how do they relate to decentralized finance?,f427b58e
How can users earn rewards in the Aavegotchi game?,f427b58e
What unique features can users customize in their Aavegotchis?,f427b58e
What is the purpose of an airdrop in the cryptocurrency space?,1ab0643e
How do I qualify to receive tokens during an airdrop event?,1ab0643e
What criteria do recipients need to meet to be part of an airdrop?,1ab0643e
What is the primary function of Akash Network in the cloud computing space?,50a11380
How does Akash Network differ from traditional cloud providers like AWS?,50a11380
What role does the AKT token play within the Akash Network?,50a11380
What mechanism does Algorand use to achieve decentralization and security?,76dce9ae
What are some of the primary uses of the ALGO cryptocurrency?,76dce9ae
How does Algorand aim to support decentralized applications and finance?,76dce9ae
What are Algorand Smart Contracts and what makes them unique?,bc59adb5
In which programming language are ASC1 contracts written?,bc59adb5
Why are Algorand Smart Contracts considered a good choice for dApps and financial transactions?,bc59adb5
What is the primary focus of Alpha Homora in the decentralized finance space?,5be8dbc6
How does Alpha Homora allow users to increase their returns when participating in liquidity pools?,5be8dbc6
What additional services does Alpha Homora provide besides leveraged yield farming?,5be8dbc6
What are the main purposes of Altcoins compared to Bitcoin?,a3edc75b
Can you give me some examples of Altcoins and their unique features?,a3edc75b
How do Altcoins improve upon Bitcoin's limitations like scalability and privacy?,a3edc75b
What type of blockchain does Anchor Protocol operate on?,dfb36789
How does Anchor Protocol generate returns for depositors?,dfb36789
What type of collateral do borrowers use in Anchor Protocol?,dfb36789
What is Ankr and what services does it provide for developers?,1e02a3b8
How does Ankr make cloud computing resources affordable?,1e02a3b8
What are the main uses of the ANKR token within its ecosystem?,1e02a3b8
What is the main function of Aragon as a platform within the cryptocurrency space?,b5f758a6
How does the ANT token contribute to the governance of the Aragon ecosystem?,b5f758a6
What are some of the primary tools that Aragon provides for managing decentralized autonomous organizations?,b5f758a6
What does arbitrage trading mean in the context of cryptocurrencies?,386fd21a
How do traders profit from arbitrage trading in different markets?,386fd21a
Can arbitrage trading be considered a low-risk investment strategy in crypto?,386fd21a
What is the primary purpose of the Arweave protocol?,78462cbd
How does Arweave ensure that data remains accessible and persistent over time?,78462cbd
What is the unique technology that Arweave uses for data storage?,78462cbd
What is the main benefit of using an atomic cross-chain swap for exchanging cryptocurrencies?,a663cd4a
How does the atomic feature of a cross-chain swap ensure transaction reliability?,a663cd4a
Is a third party required for conducting an atomic cross-chain swap between different blockchains?,a663cd4a
What is an atomic swap in the context of cryptocurrencies?,74e61101
How do atomic swaps facilitate exchanges between different blockchains?,74e61101
In what way do smart contracts contribute to the security of atomic swaps?,74e61101
What types of cryptocurrencies can I store in Atomic Wallet?,559a1c6e
Does Atomic Wallet allow me to exchange coins without a central authority?,559a1c6e
How does Atomic Wallet ensure the security of my private keys?,559a1c6e
What is an auction in the context of cryptocurrencies?,97e3ac74
What types of auctions are used for selling digital assets like NFTs?,97e3ac74
How does competitive bidding work in an auction format?,97e3ac74
What role do algorithms play in Automated Market Makers?,183b5a65
How do Automated Market Makers maintain market liquidity without an order book?,183b5a65
Can you explain how liquidity pools are used in Automated Market Makers?,183b5a65
What is the primary purpose of the Avalanche blockchain platform?,84226f2b
How does Avalanche achieve high performance and scalability?,84226f2b
Can I create my own blockchain on Avalanche and connect it with other networks?,84226f2b
What are the main activities players can do in Axie Infinity?,af2c7c88
How do players earn cryptocurrency while playing Axie Infinity?,af2c7c88
What kind of creatures do players collect and battle in Axie Infinity?,af2c7c88
What is the main focus of Badger DAO in the decentralized finance space?,79bfff8e
How does Badger DAO enable the use of Bitcoin in the DeFi ecosystem?,79bfff8e
What role does the BADGER token play within Badger DAO?,79bfff8e
What features does Balancer offer that differentiate it from traditional exchanges?,e67a2343
How does Balancer enable users to manage their portfolios effectively?,e67a2343
Can you explain what is meant by creating custom liquidity pools in Balancer?,e67a2343
What is BEP-20 and how does it relate to Binance Smart Chain?,0ae68835
In what ways is BEP-20 similar to Ethereum's ERC-20?,0ae68835
What can BEP-20 tokens be used for on the Binance Smart Chain network?,0ae68835
What is BEP-721 and what does it facilitate on Binance Smart Chain?,892fc1b9
How does BEP-721 differentiate non-fungible tokens from fungible ones?,892fc1b9
What guidelines does BEP-721 provide for managing unique digital assets?,892fc1b9
What is Binance Coin and how did it start in the cryptocurrency space?,684e1f51
In what ways can Binance Coin be utilized within the Binance platform?,684e1f51
What blockchain does Binance Coin operate on after its initial launch as an ERC-20 token?,684e1f51
What is the main purpose of Binance Smart Chain?,a115a359
How does Binance Smart Chain support decentralized applications?,a115a359
In what way is Binance Smart Chain compatible with Ethereum?,a115a359
What is the relationship between Binance USD and the U.S. dollar?,eeb90aa7
Who issued Binance USD and in collaboration with whom?,eeb90aa7
What approvals does Binance USD have regarding its regulation?,eeb90aa7
What is the main feature that allows Bitcoin to facilitate peer-to-peer transactions?,5c663a6e
Who created Bitcoin and in which year was it introduced?,5c663a6e
How does Bitcoin maintain security and validate transactions on its network?,5c663a6e
What is BitGo and who is it designed for?,515e6fa3
How does BitGo enhance security for digital assets?,515e6fa3
What type of services does BitGo offer to institutional investors?,515e6fa3
What is the primary function of a block explorer in blockchain technology?,131e7285
How can a block explorer help me verify my cryptocurrency transactions?,131e7285
What types of data can I find when using a block explorer?,131e7285
What does block finalization mean in the context of blockchain technology?,87a5db95
How does block finalization affect the immutability of transactions on a blockchain?,87a5db95
What happens to a block once it is finalized and added to the blockchain?,87a5db95
What is the purpose of a block reward in the blockchain ecosystem?,89e96d2d
What do miners or validators receive as part of the block reward?,89e96d2d
How does the block reward motivate participants in securing the blockchain?,89e96d2d
What does block time refer to in blockchain technology?,21d33efb
How does block time impact transaction processing speed?,21d33efb
In what way does block time affect network efficiency?,21d33efb
What does it mean for a blockchain to be decentralized and distributed?,4462aa17
How does blockchain achieve data security and ensure transparency?,4462aa17
Why is the irreversibility of blockchain data significant for decentralized applications?,4462aa17
What does it mean to bond assets in the context of blockchain and DeFi?,ab9472eb
Can you explain how staking tokens is related to the bonding process?,ab9472eb
What kind of rewards can users expect from bonding their assets in a network?,ab9472eb
What features make Brave Browser privacy-focused compared to other browsers?,46b60d10
How does Brave Browser allow users to earn rewards while using the platform?,46b60d10
What is the Basic Attention Token (BAT) and how does it relate to Brave Browser?,46b60d10
What does bridging mean in the context of blockchain networks?,91f390bf
How does bridging improve interactions between different blockchains?,91f390bf
What benefits does bridging provide for decentralized applications?,91f390bf
What is the purpose of a burn address in cryptocurrency?,398b2a9f
How does sending tokens to a burn address affect the total supply of a cryptocurrency?,398b2a9f
Can using a burn address increase the value of remaining tokens?,398b2a9f
What is the purpose of a burn mechanism in cryptocurrency?,27d3a2bd
How does sending tokens to a burn address affect the token's supply?,27d3a2bd
In what ways can a burn mechanism influence the value of a cryptocurrency token?,27d3a2bd
What is the significance of Byzantine Fault Tolerance in distributed systems?,6215fff7
How does Byzantine Fault Tolerance contribute to the security of blockchain networks?,6215fff7
Can Byzantine Fault Tolerance still function if some participants act maliciously?,6215fff7
What is the Byzantine Generals Problem in the context of decentralized systems?,82907989
How does the Byzantine Generals Problem relate to blockchain consensus mechanisms like Proof of Work?,82907989
Why is reaching consensus challenging according to the Byzantine Generals Problem?,82907989
Who founded the Cardano blockchain platform?,840a875c
What consensus mechanism does Cardano use for its transactions?,840a875c
How does Cardano's architecture contribute to its scalability and sustainability?,840a875c
What is a centralized exchange and how does it facilitate cryptocurrency trading?,d7582249
What are the benefits of using a centralized exchange compared to other trading methods?,d7582249
Why do users need to trust the central authority when using a centralized exchange?,d7582249
What is the purpose of chain reorganization in a blockchain network?,11bb594b
How does chain reorganization affect the integrity of the blockchain?,11bb594b
What causes a blockchain to undergo a chain reorganization?,11bb594b
What is the primary function of Chainlink in the context of blockchain technology?,acbf6258
How does Chainlink ensure that data sources are reliable and tamper-proof?,acbf6258
In which sectors besides decentralized finance is Chainlink utilized for real-world data?,acbf6258
What is the primary function of Chainlink Keepers in the blockchain ecosystem?,75405e38
How do Chainlink Keepers improve the execution of smart contracts?,75405e38
In what situations would one typically use Chainlink Keepers for automation?,75405e38
What is the purpose of Chainlink VRF in smart contracts?,856f9cb2
How does Chainlink VRF ensure the security of random number generation?,856f9cb2
In what scenarios is Chainlink VRF particularly useful for developers?,856f9cb2
What is the primary consensus mechanism used by Chia and how does it differ from traditional mining?,e2651334
How does Chia utilize hard drive space in securing its network?,e2651334
What role does the XCH token play within the Chia blockchain platform?,e2651334
What type of wallet is Coinbase Wallet and who developed it?,8718d1c5
Which cryptocurrencies can be stored in the Coinbase Wallet?,8718d1c5
What features does Coinbase Wallet offer for managing digital assets?,8718d1c5
What types of cryptocurrencies does Coinomi Wallet support?,598d76f0
How does Coinomi Wallet handle user privacy and data security?,598d76f0
Can I use Coinomi Wallet on both mobile and desktop devices?,598d76f0
What does cold storage mean in relation to cryptocurrency security?,55d5bb57
What are some methods used for implementing cold storage?,55d5bb57
Why is cold storage considered safer than online wallets?,55d5bb57
What exactly is a cold wallet in the context of cryptocurrency?,105f9e35
How does a cold wallet enhance the security of my digital assets?,105f9e35
What types of cold wallets are commonly used for long-term storage?,105f9e35
What happens to the collateral in a collateralized debt position if the loan is not repaid?,420c6c59
How does a collateralized debt position ensure the stability of a DeFi protocol?,420c6c59
What is required to initiate a collateralized debt position in DeFi?,420c6c59
What is the main purpose of the Colony framework in terms of organizational governance?,12635f68
How does Colony ensure that decision-making and resource allocation are handled?,12635f68
What system does Colony use to determine voting power and rewards among its members?,12635f68
What is the primary function of the Compound protocol in the DeFi space?,951dcc4a
How do users earn interest on their crypto assets within Compound?,951dcc4a
What role do smart contracts play in the Compound lending process?,951dcc4a
What is the purpose of a consensus mechanism in blockchain networks?,e2818a96
Can you give examples of consensus mechanisms used in blockchain technology?,e2818a96
How do consensus mechanisms contribute to network security and prevent double-spending?,e2818a96
What is the primary goal of the Cosmos network?,7567140e
How do blockchains in the Cosmos ecosystem communicate with each other?,7567140e
What does the term 'Internet of Blockchains' refer to in the context of Cosmos?,7567140e
What are the main functions of Cream Finance in the DeFi space?,ebb8de18
Can I use both stablecoins and altcoins on Cream Finance for lending and borrowing?,ebb8de18
"Does Cream Finance offer any incentives for users, such as liquidity mining?",ebb8de18
What is a cross-chain bridge and how does it transfer assets between blockchains?,02487f1d
How does a cross-chain bridge enhance interoperability in blockchain networks?,02487f1d
Can you explain how users interact with dApps using a cross-chain bridge?,02487f1d
What are cross-chain liquidity protocols and what purpose do they serve in the DeFi ecosystem?,f0d5bccb
Can you explain how cross-chain liquidity helps in decentralized trading and asset transfers across different blockchains?,f0d5bccb
"What are some examples of cross-chain liquidity protocols, and how do they function without centralized intermediaries?",f0d5bccb
What role do economic incentives play in decentralized blockchain systems?,1501af7a
How do network participants like miners and validators maintain protocol integrity?,1501af7a
In what ways does cryptoeconomics promote fair rewards for participants in blockchain networks?,1501af7a
What is the primary focus of Curve in the DeFi space?,c64ef001
How does Curve achieve low-slippage swaps between stablecoins?,c64ef001
What technology does Curve use to facilitate efficient trading?,c64ef001
What is the purpose of the Curve DAO Token (CRV) in the governance of Curve Finance?,95eef697
How does Curve Finance optimize yield farming opportunities for its users?,95eef697
What types of assets does Curve specialize in for its liquidity pools?,95eef697
What is a custodial wallet and who manages it?,3285b942
What responsibilities does a custodial wallet place on the user?,3285b942
What are the benefits and risks of using a custodial wallet?,3285b942
What kind of coin is DAI and who issues it?,538cb22c
How does DAI maintain its value in relation to the US dollar?,538cb22c
In what types of applications is DAI commonly utilized within the DeFi space?,538cb22c
What is the role of governance tokens in the DAO voting process?,53b62c96
How do members influence decisions within a Decentralized Autonomous Organization?,53b62c96
Can you explain how the voting process works in a DAO?,53b62c96
What are the main features of Dash that enhance its payment capabilities?,9e30d7c6
How is Dash different from Bitcoin in terms of its structure?,9e30d7c6
What roles do miners and master nodes play in the Dash network?,9e30d7c6
What does a debt token represent in a DeFi protocol?,bf441ae1
How does a debt token help creditors manage their claims?,bf441ae1
Can a debt token be used to transfer or liquidate debt positions?,bf441ae1
What can users buy and do in Decentraland?,ab265f0b
How does Decentraland utilize the Ethereum blockchain?,ab265f0b
What types of activities can users participate in on this platform?,ab265f0b
What does decentralization mean in the context of blockchain and cryptocurrency?,cea9a36d
How does decentralization contribute to security and transparency in a network?,cea9a36d
Why is decentralization important for the resilience of a cryptocurrency system?,cea9a36d
What is the role of governance tokens in a Decentralized Autonomous Organization?,2e36b5db
How does a Decentralized Autonomous Organization ensure transparent decision-making?,2e36b5db
What distinguishes a Decentralized Autonomous Organization from traditional organizations in terms of control?,2e36b5db
What does it mean for a decentralized exchange to operate without a central authority?,5a680a8e
How do smart contracts enhance the security of trades on a DEX?,5a680a8e
What are the key benefits of trading directly with other users on a DEX?,5a680a8e
What are the main characteristics of Decentralized Finance (DeFi) that differentiate it from traditional finance?,1c88180b
How does DeFi utilize smart contracts within its platforms for services like lending and borrowing?,1c88180b
What is the primary goal of DeFi in relation to access to financial products and services?,1c88180b
What is the main function of delegates in Delegated Proof of Stake?,358c7555
How does Delegated Proof of Stake improve upon traditional Proof of Stake?,358c7555
What benefits does DPoS offer in terms of transaction validation speed and efficiency?,358c7555
What is the role of delegators in a blockchain network?,9bdab045
How do delegators contribute to network security?,9bdab045
What benefits do delegators receive from assigning their voting power?,9bdab045
What is DFINITY and what platform does it support?,89c95528
How does DFINITY aim to change the traditional internet infrastructure?,89c95528
What token is associated with DFINITY and its applications?,89c95528
What types of items are considered digital assets?,254e7b24
How are digital assets managed and transferred?,254e7b24
Can digital assets be utilized in different digital ecosystems?,254e7b24
What does digital identity represent in the online world?,a998025b
How does digital identity help users manage their online presence?,a998025b
What are the main components included in a digital identity?,a998025b
What is the main advantage of using a Directed Acyclic Graph (DAG) in blockchain technology?,891e4fa3
How does a DAG differ from traditional blockchains in terms of transaction processing?,891e4fa3
Can you explain how transactions are confirmed in a Directed Acyclic Graph?,891e4fa3
What is the origin of Dogecoin and how did it start?,180e0f80
In what ways is Dogecoin commonly used by its community?,180e0f80
How does Dogecoin's consensus mechanism compare to that of Bitcoin?,180e0f80
What is the meaning of double spend in the context of cryptocurrencies?,a2932b09
How does double spending affect the integrity of a blockchain's transaction history?,a2932b09
Why is double spending considered a security threat in cryptocurrency transactions?,a2932b09
What is the purpose of a dust attack in the context of cryptocurrency?,64af13e5
How do dust attacks affect a user's transaction privacy?,64af13e5
What kind of information can attackers gather through a dust attack?,64af13e5
What is the main objective of an eclipse attack in a blockchain?,6d6d0f4f
How does an attacker achieve control over a target node during an eclipse attack?,6d6d0f4f
What types of malicious activities can result from an eclipse attack on a blockchain network?,6d6d0f4f
What is the main purpose of EIP-1559 in the Ethereum network?,40570d9f
How does EIP-1559 affect Ethereum transaction fees?,40570d9f
What happens to a portion of the fees collected under EIP-1559?,40570d9f
What are the main features of Electrum Wallet that make it different from other wallets?,e4448549
How does Electrum Wallet enhance security for long-term Bitcoin storage?,e4448549
Can I use Electrum Wallet for managing transactions without downloading the full Bitcoin blockchain?,e4448549
What is the main purpose of the Enigma protocol in the context of cryptocurrencies?,92adce1a
How does Enigma ensure the confidentiality of smart contract execution?,92adce1a
What role does the ENG token play within the Enigma network?,92adce1a
What is the role of Enjin Coin in supporting NFTs within the Enjin platform?,044f661c
How does Enjin Coin facilitate the creation and trading of in-game assets?,044f661c
In what ways does Enjin Coin benefit developers and players in the gaming ecosystem?,044f661c
What is the primary purpose of the EOS platform in the blockchain space?,cbc7e132
How does EOS address issues related to transaction speed and costs?,cbc7e132
"What consensus mechanism does EOS use, and how does it benefit dApp developers?",cbc7e132
What is the main purpose of the ERC-20 standard in the Ethereum blockchain?,4f0f0291
How do ERC-20 tokens ensure compatibility with decentralized applications?,4f0f0291
What are the key rules that govern the issuance and transfer of ERC-20 tokens?,4f0f0291
What distinguishes ERC-721 tokens from ERC-20 tokens in terms of their characteristics?,886bd2ce
How do ERC-721 tokens contribute to the concept of digital scarcity?,886bd2ce
What types of assets can be represented by ERC-721 non-fungible tokens?,886bd2ce
What is the main function of Ethereum in the blockchain space?,ca09e41c
How does Ethereum support decentralized finance and non-fungible tokens?,ca09e41c
What is the native currency of Ethereum and what is its role?,ca09e41c
What is Etherscan and what purpose does it serve for Ethereum users?,c16d2694
How does Etherscan enhance transparency in Ethereum transactions?,c16d2694
Can Etherscan be used to track smart contracts on the Ethereum network?,c16d2694
What is an evil maid attack and how does it relate to physical security?,69166916
In what situations is a device most vulnerable to an evil maid attack?,69166916
What kind of actions can an attacker perform during an evil maid attack on a hardware wallet?,69166916
What happens to investor funds during an exit scam in a cryptocurrency project?,f8b0ecd4
How do developers typically execute an exit scam after an ICO?,f8b0ecd4
What financial impact can an exit scam have on users involved in a fraudulent cryptocurrency platform?,f8b0ecd4
What types of cryptocurrencies can I store in Exodus Wallet?,0c5eb6e6
Does Exodus Wallet allow me to swap tokens within the app?,0c5eb6e6
Is Exodus Wallet a custodial or non-custodial wallet?,0c5eb6e6
What is Fantom and what are its primary applications in the blockchain space?,df41d1c9
How does the Lachesis consensus mechanism improve transaction finality on the Fantom platform?,df41d1c9
What advantages does Fantom offer in terms of fees and security compared to other blockchain platforms?,df41d1c9
What is the primary purpose of Filecoin in the context of data storage?,6aefb77c
How does Filecoin incentivize users to participate in the storage network?,6aefb77c
What underlying technology is Filecoin built on?,6aefb77c
What does finality mean in the context of blockchain transactions?,7e3ce362
How does strong finality contribute to the security of a blockchain?,7e3ce362
Why is it important that a confirmed block becomes a permanent part of the ledger?,7e3ce362
What is the main strategy behind flash arbitrage in cryptocurrency trading?,aa8860bd
How do traders typically execute flash arbitrage to take advantage of price discrepancies?,aa8860bd
Why is speed important in the execution of flash arbitrage trades?,aa8860bd
What causes a flash crash in the cryptocurrency market?,8f806362
How quickly does a flash crash typically happen?,8f806362
What are the potential consequences of a flash crash for investors?,8f806362
What is a flash loan in the context of decentralized finance?,ff0d1c91
How is a flash loan different from traditional loans regarding collateral?,ff0d1c91
What are some typical use cases for flash loans in the DeFi ecosystem?,ff0d1c91
What are flash loans and how are they typically provided by DeFi platforms?,04935b02
In what ways can attackers utilize flash loan attacks to exploit smart contracts?,04935b02
What kind of financial impacts can result from a flash loan attack on a DeFi protocol?,04935b02
What are the main goals of Flashbots in the context of Ethereum trading?,7a645aea
How does Flashbots aim to improve transaction processing for users?,7a645aea
What issues in high-frequency trading does Flashbots specifically address?,7a645aea
What is the purpose of Flashbots Auction in the cryptocurrency market?,a815e473
How does Flashbots Auction help in reducing front-running issues?,a815e473
In what way does Flashbots Auction improve transaction execution for traders?,a815e473
What is the purpose of Flashbots MEV in the context of miners and their transaction processes?,fd68c3f8
How does Flashbots MEV help in reducing risks associated with Miner Extractable Value?,fd68c3f8
Can you explain the specific risks like front-running and sandwich attacks that Flashbots MEV aims to mitigate?,fd68c3f8
