question,document
How does the Quant Overledger platform enhance cross-chain applications?,9427ccc8
What role does the QNT token play in the Overledger operating system?,9427ccc8
What is Ransomware and how does it operate?,bbb61681
Why do attackers prefer cryptocurrency for Ransomware payments?,bbb61681
What are the potential impacts of a Ransomware attack on individuals and businesses?,bbb61681
What is Rarible and how does it relate to NFTs?,8fe0564c
How does Rarible enable artists to earn from their digital work?,8fe0564c
In which blockchain does Rarible operate for its marketplace activities?,8fe0564c
What does the term 'Rebase' mean in the context of cryptocurrencies?,dd4a43c6
How does the mechanism of 'Rebase' affect the total supply of tokens?,dd4a43c6
Why would a cryptocurrency use 'Rebase' to adjust token amounts for users?,dd4a43c6
What is a reentrancy attack in the context of smart contracts?,55eeaa5e
How can a reentrancy attack lead to financial losses for users?,55eeaa5e
What measures can be taken to prevent reentrancy attacks during smart contract development?,55eeaa5e
What is a replay attack and how does it affect blockchain transactions?,83e05e9a
Can a replay attack lead to unauthorized asset transfers?,83e05e9a
How can security measures prevent replay attacks after a hard fork?,83e05e9a
What is the main purpose of a rollup aggregator in blockchain technology?,a64584f5
How does a rollup aggregator improve transaction efficiency?,a64584f5
In what way does a rollup aggregator impact transaction fees and scalability?,a64584f5
What are rollups and how do they work in blockchain technology?,011efbc0
How do rollups improve scalability for transactions on the blockchain?,011efbc0
In what way do rollups maintain security while processing transactions off-chain?,011efbc0
What is a rug pull in the context of DeFi?,45455459
How do developers execute a rug pull scam?,45455459
What happens to investors during a rug pull?,45455459
What constitutes a rugged project in the cryptocurrency space?,d5fe59bc
How do developers typically behave in a rugged project scenario?,d5fe59bc
What are the potential outcomes for investors involved in a rugged project?,d5fe59bc
What type of cryptocurrencies can I manage with SafePal Wallet?,c9779ba5
How does SafePal ensure the security of my cryptocurrency?,c9779ba5
What does it mean that SafePal is a non-custodial wallet?,c9779ba5
What is The Sandbox and how is it related to the Ethereum blockchain?,83aef45f
How does The Sandbox enable users to monetize their virtual assets?,83aef45f
What kind of tools does The Sandbox provide for creating virtual worlds?,83aef45f
Who is Satoshi Nakamoto and what is significant about their contribution to digital currency?,dc2537a5
In what year did Satoshi Nakamoto introduce the concept of blockchain technology?,dc2537a5
What major financial revolution is attributed to Satoshi Nakamoto's creation?,dc2537a5
What is Sharding in the context of blockchain technology?,7785900b
How does Sharding improve efficiency and throughput for decentralized applications?,7785900b
In what way does Sharding help reduce congestion on the main blockchain?,7785900b
What is Shiba Inu and how does it relate to Dogecoin?,7376c79f
What tokens are included in the Shiba Inu ecosystem?,7376c79f
What platform is associated with Shiba Inu for trading and exchanging?,7376c79f
What is a sidechain in blockchain technology?,0251e510
How do sidechains help with scaling transactions?,0251e510
Can sidechains run different consensus models without impacting the main chain?,0251e510
What are slashing conditions in the context of blockchain technology?,8c6c5183
What types of misbehavior can lead to slashing conditions for validators?,8c6c5183
How do slashing conditions contribute to the overall security of a blockchain network?,8c6c5183
What causes slippage during a trade execution?,57f08290
How does market volatility affect slippage in trading?,57f08290
In what situations is slippage more likely to occur?,57f08290
What is the main function of a smart contract in blockchain networks?,3c48f0e3
How do smart contracts contribute to automating transactions without intermediaries?,3c48f0e3
In which industries can smart contracts be utilized effectively?,3c48f0e3
What does a smart contract vulnerability refer to in the context of smart contracts?,be88f59b
How can a flaw in a smart contract's code impact financial safety?,be88f59b
Why is it important to conduct thorough code audits for smart contracts?,be88f59b
What is the purpose of snapshot voting in decentralized governance?,48a78d78
How do token holders participate in snapshot voting?,48a78d78
Which projects commonly utilize snapshot voting?,48a78d78
What is the primary goal of social engineering in the context of cryptocurrency?,e253a1d6
How do attackers typically impersonate trusted sources in social engineering schemes?,e253a1d6
What types of confidential information are commonly targeted by social engineering attacks in the crypto space?,e253a1d6
What is a soft fork in the context of blockchain technology?,1a7f35ff
How does a soft fork allow for protocol changes without creating separate chains?,1a7f35ff
Can older nodes still operate effectively after a soft fork is implemented?,1a7f35ff
What is a software wallet and how does it function in managing cryptocurrencies?,34b3ed41
Are there specific devices where a software wallet can be installed for accessibility?,34b3ed41
What are the security risks associated with using a software wallet compared to hardware wallets?,34b3ed41
What makes Solana a suitable choice for developers creating decentralized applications?,2acfda39
Can you explain the consensus mechanisms that Solana uses and how they contribute to its performance?,2acfda39
"What areas within the cryptocurrency space is Solana particularly popular in, and why?",2acfda39
What is the primary purpose of Solidity in the context of blockchain technology?,b8be6391
Which programming languages have influenced the development of Solidity?,b8be6391
How does Solidity contribute to the creation of decentralized applications on Ethereum?,b8be6391
What features does Somnium Space offer for building virtual environments?,0cd34e6e
How can users monetize their creations in Somnium Space?,0cd34e6e
What role do NFTs and the CUBE token play in Somnium Space?,0cd34e6e
What does stable yield mean in the context of DeFi?,d9baa644
How do stable yield products provide consistent returns?,d9baa644
Why are stable yield investments considered to minimize volatility?,d9baa644
What are stablecoins and what purpose do they serve in the cryptocurrency market?,f30231c7
How do stablecoins achieve price stability compared to other cryptocurrencies?,f30231c7
Could you give examples of popular stablecoins and their pegged assets?,f30231c7
What does it mean to lock up cryptocurrency in a network for staking?,e05e7de6
How do participants benefit from staking in terms of rewards?,e05e7de6
What are the primary functions that staking supports within a blockchain network?,e05e7de6
What is the purpose of a staking pool in cryptocurrency?,25f71960
How do participants benefit from joining a staking pool?,25f71960
How are rewards distributed among members of a staking pool?,25f71960
What type of game is Star Atlas and what is its primary setting?,8a71d4bc
How do players interact within Star Atlas and what activities can they participate in?,8a71d4bc
What are the names of the tokens that support the economy in Star Atlas?,8a71d4bc
What is a state channel in the context of blockchain technology?,7b83baa3
How does a state channel help in reducing fees for transactions?,7b83baa3
In what scenarios are state channels particularly beneficial for users?,7b83baa3
What is the primary purpose of the Stellar network?,f40e301e
How does Lumens (XLM) function in cross-border payments?,f40e301e
Who is the target audience for Stellar's financial services?,f40e301e
What does a stop-loss order do when a specific price point is reached?,db8cb4b0
How does a stop-loss order help in managing trading risk?,db8cb4b0
What happens to a stop-loss order after the stop price is hit?,db8cb4b0
What is SushiSwap and how does it facilitate trading cryptocurrencies?,fda837d6
Can you explain what liquidity provision and yield farming mean in the context of SushiSwap?,fda837d6
"What unique features does SushiSwap offer compared to its predecessor, Uniswap?",fda837d6
What is a Sybil attack in the context of decentralized networks?,0eb84837
How does a Sybil attack affect consensus mechanisms?,0eb84837
What are the potential consequences of a Sybil attack on network security?,0eb84837
What is a synthetic asset in the context of decentralized finance?,24ebf19e
How do synthetic assets allow trading without owning the actual asset?,24ebf19e
What role do smart contracts play in the creation of synthetic assets?,24ebf19e
What are synthetic assets in the context of Synthetix?,0c74f347
How do users participate in trading on the Synthetix platform?,0c74f347
What role do SNX tokens play in the Synthetix ecosystem?,0c74f347
What are the main benefits of the Taproot upgrade for Bitcoin transactions?,764a6d54
How does Taproot improve the functionality of smart contracts on the Bitcoin network?,764a6d54
In what way does Taproot affect data storage on the Bitcoin blockchain?,764a6d54
What is the main purpose of the Terra platform in the cryptocurrency space?,766be370
How does Terra maintain the value of its stablecoins like TerraUSD (UST)?,766be370
What types of applications and services does Terra support within its ecosystem?,766be370
What is the primary purpose of a testnet in blockchain?,f3e282e0
How does a testnet differ from a mainnet?,f3e282e0
Why is it important for developers to use a testnet before deploying on the mainnet?,f3e282e0
What unique feature does Tezos have that involves its token holders?,41405ea1
Can you explain how Tezos manages upgrades to its protocol?,41405ea1
What is the main purpose of the XTZ token in the Tezos ecosystem?,41405ea1
What are Tezos smart contracts and where are they deployed?,ecfeb178
Which programming languages are used to develop Tezos smart contracts?,ecfeb178
How do Tezos smart contracts ensure they can be updated over time?,ecfeb178
What are the main activities users can engage in within The Sandbox platform?,92f98edf
How do users utilize the SAND token in The Sandbox virtual world?,92f98edf
In what ways can players monetize their creations in The Sandbox?,92f98edf
What is the primary purpose of the Theta Network?,b9df7b4e
How can viewers benefit from participating in the Theta Network?,b9df7b4e
What is the role of the THETA token in the Theta Network ecosystem?,b9df7b4e
What is the purpose of the ThorChain protocol in the cryptocurrency space?,5d7fb5ac
How does ThorChain allow for trading assets across different blockchains?,5d7fb5ac
What role does the RUNE token play in the functionality of ThorChain?,5d7fb5ac
What does timestamping in blockchain help to prove?,30901c73
How does timestamping contribute to the security of transactions?,30901c73
Why is it important for timestamping to maintain transparency and immutability?,30901c73
What does it mean to permanently remove a cryptocurrency from circulation?,a23b5e2c
How does token burn affect the total supply of a cryptocurrency?,a23b5e2c
In what way can token burn potentially increase the value of remaining tokens?,a23b5e2c
What does tokenomics encompass in relation to cryptocurrency?,f58b466d
How does the supply and distribution affect a token's value in tokenomics?,f58b466d
What are the principles that govern a token's behavior within its ecosystem?,f58b466d
What is the purpose of the transaction pool in cryptocurrency networks?,761c22c3
How do nodes decide which transactions to include from the transaction pool?,761c22c3
What other name is the transaction pool commonly known as?,761c22c3
What is the primary function of a Treasury DAO in a blockchain community?,2dbe25c7
How does a Treasury DAO ensure transparency in fund management?,2dbe25c7
In what way do members participate in the decision-making process of a Treasury DAO?,2dbe25c7
What makes Trezor a secure option for storing cryptocurrencies?,2430227e
How does Trezor protect private keys from online threats?,2430227e
Can Trezor store multiple types of cryptocurrencies?,2430227e
What is the purpose of the Tron blockchain platform?,9fccc278
How does Tron ensure fast and scalable transactions?,9fccc278
In what ways can TRX be utilized within the Tron network?,9fccc278
What types of cryptocurrencies can I manage using Trust Wallet?,e560504b
Does Trust Wallet offer any features for decentralized exchanges?,e560504b
How does Trust Wallet ensure the security of my private keys?,e560504b
What is the primary function of the Ultra gaming platform?,696e86e4
How does the UOS token benefit users in terms of interactions with games and digital assets?,696e86e4
What advantages do developers gain from using the Ultra platform compared to traditional gaming distribution methods?,696e86e4
What is an uncle block in the context of blockchain technology?,2dc2c92a
"Why do uncle blocks, or orphan blocks, occur in a blockchain?",2dc2c92a
How do uncle blocks contribute to network security and fairness in mining?,2dc2c92a
What is Uniswap and how does it function as a decentralized exchange?,f4bb078d
How does Uniswap utilize smart contracts to manage trades and pricing?,f4bb078d
What role do liquidity pools play in the trading process on Uniswap?,f4bb078d
What does UTXO stand for and what is its role in cryptocurrency transactions?,1a92abab
How do UTXOs contribute to maintaining security and transparency in the blockchain?,1a92abab
In what way are UTXOs used as inputs for new transactions in Bitcoin?,1a92abab
What role does a validator play in a blockchain network?,b7ef478b
How are validators selected in Proof of Stake systems?,b7ef478b
What rewards do validators receive for their responsibilities in the blockchain?,b7ef478b
What is the primary focus of VeChain as a blockchain platform?,a08f762c
How does VeChain utilize smart contracts in its operations?,a08f762c
What roles do VET and VTHO play within the VeChain ecosystem?,a08f762c
What is the purpose of vote delegation in decentralized governance?,28c7d4a5
How can smaller token holders influence decision-making through vote delegation?,28c7d4a5
Who do token holders typically delegate their voting power to in vote delegation?,28c7d4a5
What is the primary function of the PYR token within the Vulcan Forged ecosystem?,9521b967
How can players earn rewards on the Vulcan Forged platform?,9521b967
What types of activities can be performed with digital assets in the Vulcan Forged universe?,9521b967
What are the main advantages of using Vyper for Ethereum smart contracts?,f82b6015
Why might developers prefer Vyper over Solidity when writing smart contracts?,f82b6015
In what types of applications is Vyper becoming more popular for use?,f82b6015
What is the main purpose of a cryptocurrency wallet?,4c143832
What are the differences between hot wallets and cold wallets?,4c143832
How do wallets help in managing digital assets?,4c143832
What is the purpose of WASM in blockchain ecosystems?,b268b220
How does WASM enhance the performance of smart contracts?,b268b220
In which types of programming languages can developers write for WASM?,b268b220
What is a web wallet and how do I access it?,161cccc5
What are the advantages of using a web wallet for my cryptocurrencies?,161cccc5
Why are web wallets considered vulnerable to hacking and phishing attacks?,161cccc5
What is a wrapped asset in the context of blockchain technology?,955d1cf5
How does a wrapped asset improve interoperability between different blockchains?,955d1cf5
In what ways can a wrapped asset be utilized within decentralized applications or protocols?,955d1cf5
What is the relationship between Wrapped Bitcoin and Bitcoin in terms of value representation?,4219fe16
How does Wrapped Bitcoin enable Bitcoin holders to use decentralized applications?,4219fe16
"What type of token is Wrapped Bitcoin, and on which blockchain is it found?",4219fe16
What does Wrapped BNB represent on the Binance Smart Chain?,afee8c9a
How does Wrapped BNB enhance the utility of BNB?,afee8c9a
In what scenarios can I use Wrapped BNB on the BSC network?,afee8c9a
What is Wrapped Ether and how does it relate to Ether?,7c21231d
Why do people use Wrapped Ether instead of regular Ether?,7c21231d
How does wrapping ETH help with decentralized applications on the Ethereum network?,7c21231d
What is Wrapped Litecoin (WLTC) and how does it relate to Litecoin (LTC)?,ace43eee
On which networks can Wrapped Litecoin (WLTC) be used for decentralized finance applications?,ace43eee
How does Wrapped Litecoin (WLTC) enhance the functionality of Litecoin beyond its original blockchain?,ace43eee
What is Wrapped Luna (WLUNA) and how does it relate to Terras Luna (LUNA)?,e14eab04
In what ways does Wrapped Luna enhance the usability of LUNA on other blockchain networks?,e14eab04
How does Wrapped Luna contribute to the interoperability of LUNA in decentralized applications?,e14eab04
What is Wrapped SOL and how does it relate to Solana?,8af380a1
How does Wrapped SOL enable its use in decentralized applications on different blockchains?,8af380a1
In what ways does Wrapped SOL expand the utility of Solana beyond its own blockchain?,8af380a1
What does Wrapped Staked Ether (stETH) represent in the Ethereum ecosystem?,674f88dd
How does stETH help stakers maintain liquidity while their ETH is staked?,674f88dd
In what way can staked ETH interact with DeFi applications through stETH?,674f88dd
What is a wrapped token and how does it function across different blockchains?,bd36e414
How does wrapping a cryptocurrency improve interoperability between networks?,bd36e414
In what scenarios can wrapped tokens be utilized within decentralized applications or liquidity pools?,bd36e414
What is Wrapped XRP (WXRP) and how does it relate to Ripple's XRP?,881d0e67
In which blockchain networks can Wrapped XRP (WXRP) be utilized?,881d0e67
How does Wrapped XRP (WXRP) enhance the use of XRP in decentralized finance applications?,881d0e67
What is Wrapped ZCash and how does it relate to ZCash?,bdb239d0
On which blockchain networks can Wrapped ZCash operate?,bdb239d0
How does Wrapped ZCash enhance the utility of ZCash in decentralized applications?,bdb239d0
What is XRP primarily used for in international transactions?,b6e3b28e
How does XRP achieve its transaction processing without proof-of-work or proof-of-stake?,b6e3b28e
Which company developed the digital currency XRP?,b6e3b28e
What is the primary function of Yearn.Finance in the DeFi space?,1129e8f7
How does YFI facilitate governance within the Yearn.Finance platform?,1129e8f7
In what way does Yearn.Finance enhance the yield for users' crypto assets?,1129e8f7
What is the primary function of a yield aggregator in decentralized finance?,9b8c2d00
How does a yield aggregator optimize returns for its users?,9b8c2d00
In what ways does a yield aggregator allocate funds across DeFi protocols?,9b8c2d00
What does it mean to provide liquidity in yield farming?,a4f3294a
How do users earn returns through yield farming?,a4f3294a
What are the typical rewards users receive in yield farming?,a4f3294a
What is the primary focus of Zcash as a cryptocurrency?,b77467c7
How do shielded transactions in Zcash improve privacy?,b77467c7
What cryptographic technique does Zcash use for optional privacy?,b77467c7
What is the main purpose of a zero-knowledge proof in the context of blockchain transactions?,a30021c2
How does a zero-knowledge proof ensure privacy without revealing the actual information?,a30021c2
Can you explain how one party can prove information validity to another using a zero-knowledge proof?,a30021c2
What are zk-Rollups and how do they function in blockchain technology?,12d6485e
How do zero-knowledge proofs contribute to the effectiveness of zk-Rollups?,12d6485e
In what ways do zk-Rollups enhance scalability and reduce fees on Ethereum?,12d6485e
What does zk-SNARK stand for and how does it function?,26b78c47
How does zk-SNARK improve privacy in transactions on the blockchain?,26b78c47
In what ways does zk-SNARK contribute to the scalability of blockchain networks?,26b78c47
What is zkSync and how does it relate to Ethereum's scalability?,970cb970
Can you explain how zkSync maintains security and decentralization while processing transactions off-chain?,970cb970
How does zkSync achieve low-cost transactions compared to the Ethereum mainnet?,970cb970
